text,name,firm
"He was an engineering director at Google following the 2006 acquisition of JotSpot, which he co-founded with Joe Kraus. Graham was one of the original six founders of Excite.com and was the chief technology officer of the company until its sale to @Home.",graham spencer,Google Ventures
"In 1999, Graham left Excite@Home to co-found DigitalConsumer.org, a 50,000-member non-profit consumer organization dedicated to protecting fair-use rights for digital media. Graham is also on the board of the Santa Fe Institute.",graham spencer,Google Ventures
"Reuben Joined GV in 2011 as an engineering partner. His career began over 20 years ago at a startup called The McKinley Group, where he contributed to making one of the first Internet search engines known as Magellan. From there he went on to Excite.com, holding multiple engineering positions in the 6 years he spent with the company.",reuben antman,Google Ventures
"Most recently, Reuben spent a year at YouTube working on a major redesign of the video management and playlist curation experiences.",reuben antman,Google Ventures
"Prior to joining Google, Reuben was the first employee at JotSpot which was acquired by Google in 2006.",reuben antman,Google Ventures
Reuben received a B.A. from U.C. Berkeley.,reuben antman,Google Ventures
"Choongsoon is a statistician at GV. Previously he worked on the quantitative marketing team at Google, focused on advertising products. He worked on some of the toughest data and analysis problems across machine learning, classification, prediction, and the design of experiments.",choongsoon bae,Google Ventures
"Before joining Google in 2009, Choongsoon conducted research in statistical theory, methodology, and applications in machine learning. His research topics included classification and regression problems in large and high-dimensional data, and he focused on the investigation of theoretical and empirical properties of the Random Forests algorithm.",choongsoon bae,Google Ventures
"Choongsoon received his Ph.D. in statistics with designated emphasis in communication, computation, and statistics from U.C. Berkeley, and his Bachelor of Science in statistics from Seoul National University, Korea. He was awarded the Erich Lehmann citation for his outstanding Ph.D. dissertation.",choongsoon bae,Google Ventures
"Adam is a general partner at GV, where he specializes in machine learning and data technology.",adam ghobarah,Google Ventures
"Prior to joining GV in 2012, Adam was a director at Google. He led a world-class team of statisticians who built models for predicting advertiser behavior and developed systems for automating machine-learning model training. Prior to joining Google, Adam worked at Mathsoft, which developed mathematical software for mechanical and civil engineers.",adam ghobarah,Google Ventures
"Adam received his doctorate in statistics from the University of Texas at Austin. He was a postdoctoral fellow at Harvard University, where he focused on the application of statistics to public health and authored several highly cited papers.",adam ghobarah,Google Ventures
"Barkha joined GV from the Google finance team, where she tackled hard data problems and was the chief of staff for the team overseeing Google’s financial systems strategy.",barkha gvalani,Google Ventures
"Prior to Google, Barkha worked at Tata Consultancy Services, where she specialized in the leasing business and consulted for GE Commercial Finance.",barkha gvalani,Google Ventures
"Barkha graduated from Mumbai University with a Bachelor of Engineering in computer science. In her free time, she loves to play strategy board games.",barkha gvalani,Google Ventures
"Erik is a partner and engineer at GV. He is part of the enterprise investing team and manages GV’s operations in New York City. Erik has over a decade of technical experience with expertise in building top-notch engineering teams and scaling massive systems. He has interests in developer tools, cloud infrastructure, and machine learning.",erik nordlander,Google Ventures
"Prior to joining GV in 2010, Erik led the development of Google’s next generation display ad serving system. He helped with the acquisition and technical integration of DoubleClick (DCLK) and led a team that built statistical and machine learning models for Google’s ad businesses. Erik was also a developer on Google’s core infrastructure, creating a distributed file system that Google.com and Gmail rely on today.",erik nordlander,Google Ventures
Erik studied computer science and engineering at MIT. He completed his graduate research at the Computer Science and Artificial Intelligence Laboratory where he focused on unique data extraction and disk forensics.,erik nordlander,Google Ventures
Erik is an avid runner and an expert in television game show theory.,erik nordlander,Google Ventures
"Ken is a partner at GV where he leads investing operations and provides product and engineering support to startups. Prior to joining GV, Ken was a group product manager at Google. In his years as a PM at Google, Ken led product initiatives for Docs, Calendar, and Google Mobile Maps.",ken norton,Google Ventures
"Ken joined Google in 2006 with the acquisition of JotSpot, where he was vice president of products. Before JotSpot, Ken led product management at Yahoo Search. Back in the day when he was a software engineer, he was one of the first 50 employees of CNET and the founding CTO of Snap (which became NBC Internet).",ken norton,Google Ventures
Ken has written extensively about the craft of product management. His classic essay “How to Hire a Product Manager” became the playbook for a generation of PMs. He’s also the reason donuts and product management have become synonymous. He earned his bachelor’s from Boston University and master’s from Rensselaer Polytechnic Institute.,ken norton,Google Ventures
"Jon is an engineering partner at GV. Prior to joining Ventures, he worked on the Google Chrome app and extension platform and Google Calendar. Previously, he led the infrastructure team at a New York City startup, where he designed and built reputation, security, storage, messaging, and monitoring systems.",jon stritar,Google Ventures
"Jon studied computer science and electrical engineering at the Massachusetts Institute of Technology. When he was a freshman at MIT, Jon created Forecastfox, a weather extension for Firefox and Chrome, which has been downloaded over 20 million times.",jon stritar,Google Ventures
"Bethany joined GV from Paris, where she led strategy projects for Google’s European partnerships.",bethany tsui,Google Ventures
"Prior to Paris, she spent two years in business strategy for Google’s global advertising operations. Bethany was originally part of the Wildfire team, which was acquired by Google in 2012.",bethany tsui,Google Ventures
Bethany graduated from Stanford University with a Bachelor of Arts in international relations and a minor in French.  ,bethany tsui,Google Ventures
Bethany is a former classical pianist and was in the 2007 Master Class Select of the California Music Teacher’s Association. She was selected to perform in the Junior Bach Festivals of 2003 and 2004 and has won several gold medals from the U.S. Open Music Competition.,bethany tsui,Google Ventures
"Jeremy joined the GV engineering team in 2014, based in New York City. He has expertise in big-data pipelines, machine learning, and implementing engineering best practices.",jeremy whelchel,Google Ventures
"Jeremy was an ads engineer at Google for over seven years. He used machine-learning systems to predict click through rates on Google shopping, analyzed ad auctions to provide advertisers with insights, and built Google’s high-volume display ad serving system. Most recently, he led the storage team for Google’s big-data analysis platform.",jeremy whelchel,Google Ventures
"Jeremy graduated from the University of Cincinnati with a B.S. in computer science and a B.A. in philosophy. In his free time, Jeremy enjoys flying airplanes and swimming in the waters around Manhattan.",jeremy whelchel,Google Ventures
Yuan is a statistician and data scientist at GV.,yuan yuan,Google Ventures
"Prior to joining GV, Yuan worked on the quantitative marketing team at Google from 2009 to 2013, and on the data science team at Dropbox from 2013 to 2015. He worked on a variety of data analysis projects, spanning sales, marketing, security, and multiple product and operational areas. Yuan focuses on statistical modeling, variable selection, machine learning, and data visualization.",yuan yuan,Google Ventures
"Yuan received his Ph.D. in statistics from Harvard University, and his master’s and bachelor’s of Engineering from Tsinghua University in Beijing, China. His research area was computational biology.",yuan yuan,Google Ventures
"Tom is a statistician and data scientist at GV. Along with his quantitative skills, he brings expertise in big data analysis with web-scale data.",tom zhang,Google Ventures
"Prior to joining GV, Tom worked at Google for over nine years. He spent the first six years in Ads Quality, analyzing and modeling various aspects of Google’s advertising business, including ads quality evaluation and prediction, user experience, and experiment framework. He spent the next three years working with Hal Varian on the Economics team, conducting research on a wide range of data problems.",tom zhang,Google Ventures
"Tom received his Bachelor of Science in mathematics from Peking University, China and his Ph.D. in statistics from Stanford University. While in school, he interned at Xerox PARC and Sun Labs doing research on document image decoding and experimental design in high-dimensional space.",tom zhang,Google Ventures
"Lem graduated with a B.S. in electrical engineering from Santa Clara University. Combining that background with his passion for people, Lem pursued a career in staffing in the tech and startup domain. Over the last seven years, he has been responsible for building up technology teams at companies including PayPal, Netflix, Ning, and Google. His mix of startup and corporate experience has given him the tools to build high performance teams in a variety of environments.",lem diaz,Google Ventures
"When Lem is away from the demands of the office, you will most likely find him enjoying the outdoors, playing poker, or having fun with his Little Brother from the Big Brother/Big Sister organization.",lem diaz,Google Ventures
Maximos is a talent partner at GV who specializes in sourcing. He has six years of experience building teams in industries ranging from nonprofit education to entertainment.,maximos lih,Google Ventures
"Before joining GV, Maximos directed HR and Operations at Miso, focused on lead generation for hiring. Previously, on the technical sourcing team at Google, he developed an analytical approach to talent discovery for niche requisitions, such as test developers, site reliability engineers, and fiber architects.",maximos lih,Google Ventures
"Maximos received degrees in neurobiology and classics from the University of California, Berkeley. He lives in the East Bay, where he is actively engaged in Oakland’s local food movement.",maximos lih,Google Ventures
Graham leads video production for GV and has been with the fund since 2012. He focuses on producing video content for portfolio companies.,graham hancock,Google Ventures
"Graham is a filmmaker and video producer with over a decade of production and storytelling experience. Prior to joining GV, Graham produced Kevin Rose’s “Foundation” interview series. He began his career as an editor for Discovery Digital Networks (Formerly Revision3) where he led post-production for several weekly web-series and podcasts. As a freelance video producer, Graham has also made videos for Salesforce, AOL, Seagate, Pandora, and Sony.",graham hancock,Google Ventures
Graham received his bachelor’s degree in communications and broadcasting from Mississippi State University and lives in San Francisco.,graham hancock,Google Ventures
Mandy is a communications partner at GV and has been with the fund since 2012. She works closely with portfolio companies on PR strategy and initiatives. ,mandy kakavas,Google Ventures
"Mandy has been working in technology communications for over a decade. Prior to GV, Mandy held roles as a Senior Account Executive at both the OutCast Agency and Horn Group, where she advised global brands and startups including Salesforce, Intuit, Khosla Ventures, Zynga, Cisco WebEx, and Riverbed Technology. She began her communications career with Fleishman-Hillard’s technology practice. Previously, Mandy worked in editorial at Glam.com and in movie publicity at Terry Hines & Associates, supporting Lionsgate Films and New Line Cinema.",mandy kakavas,Google Ventures
"Mandy received her bachelor’s degree in mass communications from the University of California, Berkeley. Mandy also volunteers with BuiltByGirls’ WAVE program, mentoring young women pursuing careers in technology.",mandy kakavas,Google Ventures
Jodi leads communications for the GV team and advises portfolio companies on their public relations strategies.,jodi olson,Google Ventures
"Prior to joining GV, Jodi led consumer and platform communications for Twitter, during a time when the company grew rapidly from startup to global brand. Previously, she ran marketing communications for social search company Kosmix, which was acquired by Walmart. Jodi spent the earlier years of her career on the PR agency side, consulting to a mix of Fortune 500 companies and technology startups.",jodi olson,Google Ventures
"Jodi received her bachelor’s degree in literature and writing from the University of California, San Diego and her master’s degree in literary history and cultural discourse from the University of Sussex in the United Kingdom.",jodi olson,Google Ventures
"Monica leads marketing at GV, working with portfolio companies at the intersection of product, engineering, and the user. She likes technical product marketing and splashy brand campaigns in equal parts. ",monica tran,Google Ventures
"Monica’s experience spans consumer, B2B, and developer marketing. Prior to joining GV, Monica drove growth and acquisition for Google Maps, Search, and AdWords. She led go-to-market for mobile ads in Asia and Europe. Monica went on to become the creative force behind Google I/O and managed the developer marketing team responsible for Android and API adoption. Her work has appeared at the Sydney Opera House, in outbound sales calls, and on the wrists of PAC-MAN enthusiasts around the world.",monica tran,Google Ventures
"Monica graduated with honors from UC Berkeley, studying business and Shakespeare. She has worked for Google in London, Tokyo, and Sydney. Once upon a time, you could find her working security at the OC Fair’s Gate 4 ½. ",monica tran,Google Ventures
"Lauren focuses on growth and marketing at GV. Drawing on over a decade of experience in marketing and product management, she provides end-to-end expertise from development to launch and growth.",lauren usui,Google Ventures
"Lauren’s been in the startup ecosystem as a founder, marketer, product manager, and consultant. As a founder, she led product development and marketing acquisition for a fitness app before starting a product consultancy helping startups. Previously, Lauren was an early product manager at NerdWallet and held product marketing roles at Google launching display ads products and managing AdMob’s mobile ads brand after acquisition.",lauren usui,Google Ventures
"Lauren graduated from the Sauder School of Business at the University of British Columbia. Outside of technology, Lauren enjoys spending time outside climbing or making things the old fashioned way.",lauren usui,Google Ventures
"Rick leads the partnerships team at GV, where he connects the largest companies in the world to GV’s portfolio. Rick was previously a product manager at Google where he led product initiatives on Blogger, Google+, and YouTube.",rick klau,Google Ventures
"Rick’s earlier professional experience includes leadership roles at several software and Internet startups. He was an early employee at FeedBurner, where he ran the publisher services team until Google acquired the company in 2007. Rick received dual degrees from Lafayette College, and while a student at the University of Richmond School of Law, he founded the Richmond Journal of Law & Technology, the world’s first student-edited law journal to publish exclusively online.",rick klau,Google Ventures
"Outside of his love of technology, Rick is also a political junkie. He provided technology advice to three U.S. presidential campaigns, ran the campaign blog for President Barack Obama in his 2004 Senate race, and ran product strategy for Google’s presence at the Democratic National Convention in 2008. He is a member of the board of directors of the National Center for Women & Information Technology and Defy Ventures Bay Area.",rick klau,Google Ventures
Tracie co-founded GV’s partnerships practice in 2013. She continues to manage and expand the program by connecting the largest companies in the world with GV’s portfolio.,tracie rotter,Google Ventures
"Tracie works with Fortune 500s and other corporations to understand their priorities, and helps them partner with GV’s portfolio. She coaches startup founders and business-development leads on how to effectively pitch their products. Tracie also works with Google and other strategic partners to get GV companies the tools and help they need to scale.",tracie rotter,Google Ventures
"Prior to joining GV in 2010, Tracie worked in consulting and non-profits. As a consultant at Accenture, her clients included Caterpillar, Verizon Fios, PepsiCo, Pfizer, MetLife, and Hertz.",tracie rotter,Google Ventures
"Outside of GV, Tracie works with startups through Duke University’s Global Entrepreneurship Network, and as an angel investor. An avid volunteer, Tracie spends time with local organizations focusing on children’s health and aiding veterans.",tracie rotter,Google Ventures
Tracie graduated from Duke University with a bachelor’s in economics and minors in Spanish and religion.,tracie rotter,Google Ventures
Deena manages partnerships for GV’s portfolio companies. She helps startups scale and grow by connecting them to the world’s largest companies. ,deena shakir,Google Ventures
"Prior to joining GV, Deena spent five years at Google doing business development for early-stage products in health care, research and machine intelligence, and search. She also spearheaded social impact investments for Google.org.",deena shakir,Google Ventures
"Deena previously led public-private partnerships with Global 2000 companies as a presidential management fellow in the office of Secretary Clinton at the U.S. State Department. At the U.S. Agency for International Development, Deena was a partnerships advisor where she helped launch President Obama’s first Global Entrepreneurship Summit in 2010.",deena shakir,Google Ventures
"Deena co-founded her first company at 19, and is an angel investor and startup adviser. She serves on the boards of TechWadi, the Harvard Alumni Association, the Project on Middle East Democracy, the Arab Film Festival, and the Asian University for Women. She is also an adviser to Girls Who Code.",deena shakir,Google Ventures
"Deena holds a joint Bachelor of Arts in social studies and Near Eastern languages and civilizations from Harvard College and a master’s degree from the Georgetown University School of Foreign Service. She delivered the 2008 Harvard Class Day speech, “From Baghdad to Boston: Dropping the Global H-Bomb.”",deena shakir,Google Ventures
"Daphne M. Chang is General Counsel at GV, where she manages all aspects of the fund’s legal operations, advises on deal structures and governance matters, and oversees the fund’s compliance and risk management programs.  ",daphne chang,Google Ventures
"Prior to joining GV in 2011, Daphne was an attorney at Wilson Sonsini Goodrich & Rosati, where she counseled startups and public companies on a broad range of corporate, securities, and other business issues.",daphne chang,Google Ventures
Daphne received her J.D. from UCLA School of Law and her bachelor’s degree from Stanford University.,daphne chang,Google Ventures
"Nathan is a senior financial analyst at GV. Nathan joined GV from Alphabet, where he worked at Google and X. Previously, he was an accountant at PricewaterhouseCoopers LLP in both its audit and consumer-finance practices.",nathan amchan,Google Ventures
"Nathan graduated magna cum laude from The Ohio State University with a double major in accounting and finance. He is a CPA, licensed in the state of Ohio, and a CFA charterholder.",nathan amchan,Google Ventures
"Beth is an Administrative Business Partner at GV. Prior to joining the team, Beth supported partners as an executive assistant at Sequoia Capital. She previously worked as a wellness program coordinator at Stanford University, providing biometric screenings and health education to the faculty and staff. ",beth ayres,Google Ventures
Beth graduated from University of Arizona with a Bachelor of Arts in education.,beth ayres,Google Ventures
Jessica is a finance manager at GV and works on the fund’s portfolio reporting and accounting functions.,jessica ashford,Google Ventures
"Jessica came to GV with four prior years of venture capital experience, working as a finance manager at Sequoia Capital and more recently a fund controller at Standish Management. She began her career in audit at PricewaterhouseCoopers LLP in San Jose.",jessica ashford,Google Ventures
Jessica graduated with a degree in business administration from California Polytechnic State University where she obtained a double concentration in accounting and finance.,jessica ashford,Google Ventures
"Marissa joined the GV team in January 2017. Prior to GV, Marissa worked as an executive assistant at Relay Ventures and a medical practice manager at Revere Health. Marissa graduated from Brigham Young University with a bachelor’s degree in exercise science.",marissa benson,Google Ventures
Natalie is a senior financial analyst at GV and works on the fund’s portfolio reporting and accounting functions.,natalie bosque,Google Ventures
"Prior to joining GV, Natalie was a senior fund accountant at Sequoia Capital. Previously, she worked as an assurance associate at PricewaterhouseCoopers LLP, where she audited clients in life science and venture capital.",natalie bosque,Google Ventures
Natalie graduated from Santa Clara University with a degree in finance and an emphasis in accounting.,natalie bosque,Google Ventures
"Kim is the Head of Finance at GV and leads the fund’s portfolio reporting and accounting functions. She joined the team in 2010 with four previous years of venture capital experience. Most recently she was the controller at BlueRun Ventures and before that, the finance manager at Sequoia Capital. Kim started her career at Deloitte and Touche in Los Angeles where she earned her CPA license (inactive) and spent time in Deloitte’s Sydney office prior to moving back to the Bay Area. ",kim burr,Google Ventures
"Kim graduated from the University of California, Los Angeles with a degree in business economics and a minor in accounting. In her past life, Kim played roller derby on a national level and was a snowboarding instructor. ",kim burr,Google Ventures
"Laura joined the GV team after working as executive assistant to the founder and CEO of TechCrunch. Prior to joining the tech world, she was a marketing and communications manager at Cummins West, Inc. in San Leandro. Previously, she worked as an account coordinator and media planner at two ad agencies in Orange County: Johnson Gray Advertising and Mindshare Creative. Laura graduated from the University of California, Berkeley with a B.A. in sociology and a minor in Spanish",laura gifford,Google Ventures
"Christina joined GV in September 2011. Prior to joining the team, she was office manager and executive assistant to the founder/chief creative officer at TOTH+Co, a boutique advertising agency in Cambridge, Massachusetts.",christina kelleher,Google Ventures
"Previously, she worked as an event planner at a catering company in Charlestown, Massachusetts, organizing both corporate and social events. She also has experience in the field of public relations, most notably working at Context Marketing in Sausalito, California for the California Milk Advisory Board “Real California Cheese” and “Happy Cows” campaigns.",christina kelleher,Google Ventures
Christina graduated from Syracuse University with a Bachelor of Science in advertising and a Bachelor of Arts in psychology.,christina kelleher,Google Ventures
Evalynne joined GV in April of 2014 and has worked in the technology and venture capital industry since 2004.,evalynne lee,Google Ventures
"Prior to joining the team, she was an executive assistant at Redpoint Ventures, managed operations at Utell Communications, and worked with the California Public Interest Research Group on community outreach and environment-focused events.",evalynne lee,Google Ventures
"Evalynne graduated from the University of California, Irvine with a Bachelor of Arts in political science.",evalynne lee,Google Ventures
"Danielle joined GV in April 2014. Prior to joining the team, she spent four years as an executive assistant at TPG Capital, providing support for a partner on their healthcare team.",danielle lewis,Google Ventures
"Previously, Danielle was an executive assistant at Highbridge Capital Management, a hedge fund based in New York. Danielle left Highbridge to pursue an MBA from Pepperdine University.",danielle lewis,Google Ventures
