text,name,firm
"Danielle received her Bachelor of Science in management science from the University of California, San Diego.",danielle lewis,Google Ventures
"Prior to joining GV, Victoria was an executive assistant at TPG Special Situations Partners.",victoria miller,Google Ventures
"Victoria moved to San Francisco from New York City, where she worked at a boutique private equity firm for three years. She graduated from Gettysburg College in Pennsylvania with a Bachelor of Arts in business management and a minor in writing.",victoria miller,Google Ventures
"Joining in 2017, Shane brings an eclectic background to the GV team. ",shane peltzman,Google Ventures
"Starting his career in film production, he was the assistant to actor and comedian Russell Brand. He later worked with the David Lynch Foundation as an executive assistant and events producer, and was the executive assistant to designer Michael Smith. ",shane peltzman,Google Ventures
Shane graduated with a bachelor’s degree in film and media arts from Temple University.,shane peltzman,Google Ventures
"Prior to joining GV in 2016, Lauren was an executive assistant at Barclays Investment Bank in London. ",lauren powell,Google Ventures
"Previously, she lived in Sydney, where she worked as an executive assistant at Gallup Consulting, a behavioral-economics consultancy, and Lidis Group, a boutique private-equity firm specializing in real estate. ",lauren powell,Google Ventures
"Vidu is legal counsel for Europe and works on deal sourcing, diligence, and managing investments. ",vidu shanmugarajah,Google Ventures
"Vidu has a broad background spanning corporate law, startups, and investing. He began his career at Linklaters, advising companies and investment funds on mergers and acquisitions, financings, and commercial deals. Following Linklaters, Vidu founded an online marketplace that provided better access to legal advice for startups and small businesses. He also helped launch Grafton Capital, a London-based growth equity firm, and spent time at HgCapital on buyout and growth investments in the technology and renewable energy sectors.",vidu shanmugarajah,Google Ventures
Vidu holds a degree in law from the London School of Economics. He continues to advise startups on all types of legal and business issues.,vidu shanmugarajah,Google Ventures
"Celeste joined GV in December 2015. Prior to joining the team, she was an executive assistant at TPG Growth for four years. Previously, she lived in New York City and supported the chief financial officer of American Express.",celeste schnackenberg,Google Ventures
Celeste holds an MBA from the University of Phoenix and a B.A. in communications from Brigham Young University.,celeste schnackenberg,Google Ventures
"Robin is the Controller at GV and oversees the fund’s portfolio reporting and accounting functions. Prior to joining the team, Robin worked at Sequoia Capital and Ernst & Young.",robin teng,Google Ventures
Robin graduated from UCLA with a degree in business economics and a minor in accounting. She then earned her master’s in accountancy from the University of Notre Dame.,robin teng,Google Ventures
"In her free time, Robin volunteers with a local education non-profit, cheers on her UCLA Bruins, and enjoys spending time outdoors with Scout, her squirrel-obsessed dog.",robin teng,Google Ventures
"Chris is a corporate paralegal at GV. Prior to joining the team in 2014, Chris worked at Google on the securities and corporate governance legal team. Chris assisted with Google’s public company obligations including board of directors matters, Securities and Exchange Commission registrations and filings, and investor relations.",chris urenda,Google Ventures
"Chris graduated cum laude from the University of California, San Diego, with a dual degree in economics and political science.",chris urenda,Google Ventures
Elizabeth is legal counsel at GV.,elizabeth zeratsky,Google Ventures
"Prior to joining the GV team, Elizabeth was an associate at Cooley LLP. She counseled institutional investors and a variety of public and private companies on venture capital financings, mergers and acquisitions, and securities transactions.",elizabeth zeratsky,Google Ventures
Elizabeth received her Bachelor of Arts and Master of Arts in history from Stanford University and her J.D. from Northwestern University School of Law.,elizabeth zeratsky,Google Ventures
Shernaz is a leading marketing and business executive. She has over 20 years of experience building brands and consumer perception; advising executive management; scaling operational teams; and developing global businesses to accelerate growth and mindshare.,shernaz daver,Google Ventures
"Over her career, Shernaz has worked with companies such as Netflix, Walmart, Polyvore (Yahoo), Baidu, Khan Academy, Zynga, Guardant Health, Motorola, Indiegogo, Red Hot Labs (Google), Opsware (HP), Samsung, Truveo (AOL), Savvis (CenturyLink), Nokia, Metaplace (Disney), and MetaMarkets (Snap). She serves as an advisor to several companies including Baobab Studios, Passage, Paysa, and Voyage.",shernaz daver,Google Ventures
"Most recently, she was the chief marketing officer for Udacity where she built a world-renowned brand in the online learning space and propelled its growth and stature to millions of users and Fortune 500 partners.",shernaz daver,Google Ventures
"Previously, Shernaz served as the chief marketing officer and head of investor relations at Inktomi. Under her leadership, Inktomi became one of the hottest Internet names reaching a $37 billion valuation, and received numerous media and Wall Street accolades. Shernaz started her career at Sun Microsystems where she built a brand name for Solaris, the Sun operating system, and spearheaded the company’s European software initiatives from Paris.",shernaz daver,Google Ventures
"Steve Chen was the co-founder and chief technology officer of YouTube. Steve arrived in Silicon Valley in 1999 to join PayPal. On his first day at PayPal, Steve met Chad Hurley, who would become his YouTube co-founder, together with Jawed Karim.",steve chen,Google Ventures
"Steve was instrumental in building YouTube into a viral video phenomenon. He helped lead YouTube through the Google acquisition for $1.65 billion, less than a year after launching the site. As the key technologist, Steve developed the company’s massive data centers and helped build YouTube into a premier entertainment destination, and one of the most popular websites on the Internet today.",steve chen,Google Ventures
"Steve has received several prestigious honors and acknowledgments from the business and entertainment communities including: Business 2.0’s “50 Most Influential People,” GQ’s “Men of the Year,” Time magazine’s “Best Invention of the Year”, and Fortune’s “Most Powerful People in Business.” Steve joins GV from AVOS, the incubator he founded with Chad Hurley in 2011.",steve chen,Google Ventures
"Andy Conrad, Ph.D., is the CEO of Verily (formerly Google Life Sciences) where he oversees more than 350 scientists working on a wide spectrum of healthcare-related projects. Previously, he was chief scientific officer of Laboratory Corporation of America (LabCorp). Dr. Conrad co-founded the National Genetics Institute, where he served as chief scientific officer. Dr. Conrad also founded the California Health and Longevity Institute (CHLI). In addition, he serves as the chief scientific adviser of the North Carolina Research Campus (NCRC), an academic collaboration between Duke University, University of North Carolina, and North Carolina State University.",andy conrad,Google Ventures
"Stephen Gillett is a senior leader at X, working on moonshots, and an active adviser to GV​​. His diverse leadership experience spans across enterprise software, Internet, retail, and consumer technology​ and ​serves on the board and a​s​ an independent director of Chipotle Mexican Grill.",stephen gillett,Google Ventures
"Stephen most recently served as executive vice president and chief operating officer of Symantec, and as a member of its board of directors. Previously, he held executive positions at Best Buy as president of digital, marketing and operations, and at Starbucks as chief information officer and GM of digital ventures. His background also includes senior technology positions at Yahoo! and CNET Networks. ",stephen gillett,Google Ventures
"Stephen holds a bachelor’s degree from the University of Oregon, and was a member of the Ducks football team. He has a master’s degree in business administration from San Francisco State University. Stephen is also a globally recognized gamer, most often associated with being an accomplished Guild Master in World of Warcraft.",stephen gillett,Google Ventures
"Craig Kornblau built his media career at NBC Universal and Disney, where he spearheaded projects around transformative technology and delivery. Craig is now principal of a strategic consulting firm, working closely with private equity firms and entrepreneurs.",craig kornblau,Google Ventures
"Craig was president of Universal Studios Home Entertainment for 15 years, where he oversaw sales, marketing, distribution, and finance for Universal’s North American home entertainment operations. Prior to Universal, Craig was an executive at Buena Vista Home Video, now Walt Disney Home Entertainment. Craig serves on the board of directors of Media Audits International, and is strategic adviser to ROW8, a service that will distribute premium content to consumers at home via the Internet.",craig kornblau,Google Ventures
"Craig has held board positions with the Consumer Electronics Association, Digital Entertainment Group, and Next Level Communications. Craig earned a Bachelor of Science degree from the University of Southern California, Marshall School of Business.",craig kornblau,Google Ventures
Yoky Matsuoka is the chief technology officer of Nest. She was a founder of Google[x] and previously held roles as CEO of Quanttus and the vice president of technology of Nest.,yoky matsuoka,Google Ventures
"Previously, Yoky was a professor at Carnegie Mellon University and the University of Washington. She developed robotic devices for rehabilitating and assisting the human body and brain, earning the MacArthur award in 2007. She was named one of the Brilliant Ten by Popular Science magazine and one of the Barbie® Top 10 Women to Watch in 2010.",yoky matsuoka,Google Ventures
"Yoky grew up assuming she would be a professional tennis player, but instead earned a BS degree from UC Berkeley and a PhD from MIT in electrical engineering and computer science in the fields of artificial intelligence and computational neuroscience.",yoky matsuoka,Google Ventures
Rich co-founded Android and is a pioneer in the mobile space. ,rich miner,Google Ventures
"Rich is based in Cambridge, Mass. He has over 25 years of experience growing businesses with innovative communications and interface-intensive applications. ",rich miner,Google Ventures
"Rich established GV’s east coast investing team in 2009 and was a general partner with the fund for seven years. He came to Google through the acquisition of Android, a mobile platforms company that he co-founded. During his early years at Google, he helped lead the development of the Android platform and ecosystem. Prior to Android, Rich was a vice president at Orange, where he led R&D activities in North America and was an original principal at Orange Ventures when it was founded. Rich came to Orange through the acquisition of another company he co-founded, Wildfire, which developed a voice-based personal assistant. ",rich miner,Google Ventures
Rich received his Ph.D. in computer science from the University of Massachusetts at Lowell.,rich miner,Google Ventures
"Peter Norvig is a fellow of the American Association for Artificial Intelligence and the Association for Computing Machinery. At Google, Inc. he was director of search quality, responsible for the core Web search algorithms from 2002-2005, and has been director of research from 2005 on.",peter norvig,Google Ventures
"Previously, he was the head of the Computational Sciences Division at NASA Ames Research Center, making him NASA’s senior computer scientist. He received the NASA Exceptional Achievement Award in 2001. He has served as an assistant professor at the University of Southern California and a research faculty member at the University of California at Berkeley Computer Science Department, from which he received a Ph.D. in 1986 and the distinguished alumni award in 2006. He has over fifty publications in computer science, concentrating on artificial intelligence, natural language processing and software engineering, including the books Artificial Intelligence: A Modern Approach (the leading textbook in the field),Paradigms of AI Programming: Case Studies in Common Lisp, Verbmobil: A Translation System for Face-to-Face Dialog, and Intelligent Help Systems for UNIX. He is also the author of the Gettysburg Powerpoint Presentation and the world’s longest palindromic sentence.",peter norvig,Google Ventures
"Sanyin Siang is an author, speaker, and leadership coach. She co-founded and leads the Coach K Center on Leadership & Ethics (COLE) at Duke University’s Fuqua School of Business. COLE is a leadership laboratory that convenes high-level think tanks to explore today’s challenges.",sanyin siang,Google Ventures
"Sanyin coaches CEOs and is among the first 25 of Marshall Goldsmith’s 100 Coaches. She applies an ecosystem approach to problem solving, innovation, and culture building.    ",sanyin siang,Google Ventures
"Sanyon is a mentor for Praxis Business Accelerator. She advises and serves on boards of startups and nonprofits, including the Emily Krzyzewski Center, The Sports Innovation Lab, and DukeCE. She is a member of the 86th Joint Civilian Orientation Conference in the U.S. Department of Defense.",sanyin siang,Google Ventures
"Sanyin received a Bachelor of Science in biomedical engineering and an MBA from Duke University. Her new book — The Launch Book: Motivational Stories to Launch Your Idea, Business, or Next Career — is out in August 2017.",sanyin siang,Google Ventures
"Stephan Somogyi works in security and privacy product management at Google. He’s currently on the Chrome team, developing new approaches to make computing safer and more privacy-preserving.",stephan somogyi,Google Ventures
"Previously, Stephan led the expansion of Safe Browsing, Google’s system that protects over three billion devices worldwide from malware and phishing. He also built and led Motorola’s Privacy Engineering team after the acquisition through the launch of the first Moto X; worked on End-To-End, a project to make strong encryption more usable; as well as a variety of other security and privacy efforts.",stephan somogyi,Google Ventures
"Prior to joining Google, Stephan held a range of global security and product management roles, including stints at VMWare and Infineon. He was previously the Director of Products at PGP Corporation, and has also worked in brand strategy and information design. In a former life, he was a business, technology, and design journalist, writing for the Economist, the Financial Times, Wired, and I.D. Magazine, among others.",stephan somogyi,Google Ventures
"Hal R. Varian is the chief economist at Google. Since 2002 he has been involved in many aspects of the company, including auction design, econometric analysis, finance, corporate strategy and public policy.",hal varian,Google Ventures
"Hal also holds academic appointments at the University of California, Berkeley in three departments: business, economics, and information management.",hal varian,Google Ventures
"Hal is a fellow of the Guggenheim Foundation, the Econometric Society, and the American Academy of Arts and Sciences. He was co-editor of the American Economic Review from 1987-1990 and holds honorary doctorates from the University of Oulu, Finland and the University of Karlsruhe, Germany.",hal varian,Google Ventures
"He has published numerous papers in economic theory, industrial organization, financial economics, econometrics and information economics. He is the author of two major economics textbooks which have been translated into 22 languages. He is the co-author of a bestselling book on business strategy, Information Rules: A Strategic Guide to the Network Economy and wrote a monthly column for the New York Times from 2000 to 2007.",hal varian,Google Ventures
"He received his S.B. degree from MIT and his M.A, in mathematics and Ph.D. in economics from UC Berkeley. Hal has also taught at MIT, Stanford, Oxford, Michigan and other universities around the world.",hal varian,Google Ventures
"Susan Wojcicki is CEO of YouTube, the world’s most popular digital video platform used by over a billion people across the globe to access information, share video, and shape culture. An early champion of online video who was instrumental in Google’s 2006 acquisition of YouTube, Susan now oversees YouTube’s content and business operations, engineering, and product development. ",susan wojcicki,Google Ventures
"Prior to joining YouTube in February 2014, Susan was Senior Vice President of Advertising & Commerce at Google, where she oversaw the design and engineering of AdWords, AdSense, DoubleClick, and Google Analytics. She joined Google in 1999 as the company’s first marketing manager and led the initial development of several key consumer products including Google Images and Google Books. In 2002, Susan began working on Google’s advertising products and over the next 12 years she led teams that helped define the vision and direction of Google’s monetization platforms. ",susan wojcicki,Google Ventures
"Susan graduated with honors from Harvard University, holds a master’s in economics from UC Santa Cruz, and an MBA from UCLA. In 2015, Susan was named to Time’s list of the 100 most influential people in the world.",susan wojcicki,Google Ventures
