text,name,firm
"David is the CEO & managing partner at GV and oversees the fund’s global activities. He invests in a wide range of technology companies including Uber, Nest, Blue Bottle Coffee, and Urban Engines. David’s Google career began more than 17 years ago, as director of Global Communications and Public Affairs. In this role, David oversaw the company’s strategic communications programs worldwide, and worked as a member of the senior leadership team to grow Google from a small startup to a multi-billion dollar global enterprise.",david krane,Google Ventures
"David’s prior professional experience spanned both startup and public companies, including Apple Computer, QUALCOMM, Four11 (now Yahoo! Mail), and two computer security software developers.",david krane,Google Ventures
"David is also on the board of Metro-Goldwyn-Mayer Inc. (MGM), a member of Young President’s Organization (YPO), a trustee of San Francisco’s Contemporary Jewish Museum of Art, and a Menlo/Atherton Little League baseball coach. David received his Bachelor of Arts in journalism from Indiana University Bloomington. As a proud Hoosier alumnus, he serves on the Dean’s advisory board for the IU School of Informatics, Computing, and Engineering. David resides in the Bay Area with his wife, three children, and their labradoodle.",david krane,Google Ventures
"Vineeta is a physician-scientist who is passionate about the intersection of data science and health care. As a director of product management at Flatiron Health, she has led development of national-scale databases that integrate clinical and genomic data for drug development and research in oncology.",vineeta agarwala,Google Ventures
"Previously, Vineeta studied the genetic basis of common disease at the Broad Institute of Harvard & MIT. She has also been a computational researcher at Cold Spring Harbor Laboratory and Lawrence Livermore National Laboratory, an early data scientist at Boston-based health tech startup Kyruus, and a management consultant for biotech, pharmaceutical, and medical device clients at McKinsey & Company in New York.",vineeta agarwala,Google Ventures
Vineeta has a B.S. in biophysics from Stanford University. She also earned M.D. and Ph.D. degrees from Harvard Medical School and MIT. She is currently a medical resident at Stanford.,vineeta agarwala,Google Ventures
"Brian is a partner on the GV investing team focusing on investments in platforms, machine learning, and infrastructure.",brian bendett,Google Ventures
"Prior to joining GV, Brian managed projects at Google across people operations, finance, marketing, and corporate development. In a former life, Brian worked in private equity and spent time in Washington D.C. supporting the White House Council of Economic Advisers and the Office of the Vice President.",brian bendett,Google Ventures
"Brian is from West Hartford, Connecticut and graduated magna cum laude from Cornell University with a degree in economics.",brian bendett,Google Ventures
"Terri is a principal on the investing team at GV. Previously she was an associate product manager at Twitter, where she focused on user experience. Terri also worked as a developer evangelist and front-end engineer at Venmo, a mobile payments company.",terri burns,Google Ventures
"Terri studied computer science at New York University.  In her spare time, she speaks and writes on issues related to technology, diversity, and inclusion.",terri burns,Google Ventures
"Blake is an engineer, scientist, and entrepreneur who has been working with GV since 2010. As an investor, Blake partners with founders on life-science and digital companies — from drug development and healthcare delivery to financial services and information security. Blake’s life-science investments include Denali, Grail, and ARMO BioSciences, and his digital investments include Gusto (formerly ZenPayroll), Robinhood, Ionic Security, and LendUp. ",blake byers,Google Ventures
"Prior to GV, Blake helped start two companies, led research projects on biomedical engineering and stem cells at Stanford, and was an angel investor. ",blake byers,Google Ventures
Blake received a Ph.D. and master’s in bioengineering from Stanford University and holds Bachelor of Science degrees in biomedical engineering and economics from Duke University.,blake byers,Google Ventures
"Tyson is a general partner at GV. He spent his career in enterprise technology, focusing on companies in the SaaS application and data center infrastructure spaces.",tyson clark,Google Ventures
"Prior to joining GV, Tyson was a partner at Andreessen Horowitz, where he was on the corporate development team and advised enterprise portfolio companies. He led acquisitions in the enterprise SaaS space for Oracle’s corporate development group, and worked as an investment banker at Morgan Stanley, where he oversaw IPO and M&A transactions for a variety of cloud companies.",tyson clark,Google Ventures
"Tyson spent six years in the United States Navy, serving on submarines as both as a nuclear propulsion officer and Navy scuba diver.",tyson clark,Google Ventures
Tyson holds a B.S. in industrial engineering from Stanford (with honors) and an MBA from Harvard Business School.,tyson clark,Google Ventures
"Karim leads GV’s investments in enterprise software, data analytics, and security. He brings over a decade of operational and investment experience to his role. He initially joined Google’s corporate development team in 2008, the group responsible for all mergers and acquisitions and has been at GV since inception.",karim faris,Google Ventures
"Prior to Google, Karim was a venture capitalist at Atlas Venture, where he worked on investments in software and Internet infrastructure. Previously, he was director of New Ventures at Level 3 Communications, responsible for evaluating new business opportunities and has led product development for the company’s voice services. Earlier in his career, Karim held various product and marketing roles at Intel, initially on the i486™, and later as product manager for the Pentium® Processor. He started his career at Siemens as a software engineer working on the first vehicle navigation system for BMW.",karim faris,Google Ventures
"Karim holds an MBA from the Harvard Business School, an M.S. in electrical engineering from the University of Michigan, and a B.S. in computer engineering from Brown University where he published several papers on neural networks.",karim faris,Google Ventures
"Tom is a general partner at GV. Prior to GV, Tom was a design director at IDEO Europe. He founded OpenIDEO, an open innovation platform where 100,000 users from more than 170 countries solve challenges for social good. Tom also launched OIEngine, a SaaS platform with clients including Harvard Business School and the Knight Foundation.",tom hulme,Google Ventures
"Prior to IDEO, Tom was managing director of Marcos, a British sports car manufacturer and founded Magnom, a magnetic filter startup. Tom’s filter designs have been widely used in Formula One, superbikes, agricultural equipment, and central heating systems.",tom hulme,Google Ventures
"Tom has also angel-invested in more than 20 companies, including as the founding investor in Mile IQ (sold to Microsoft). ",tom hulme,Google Ventures
"Tom has been recognized as a Young Global Leader by the World Economic Forum, and has been featured in WIRED UK’s Top 100 Digital Power Brokers list every year since the list was established. He has also been included in the Evening Standard list of London’s 1000 Most Influential People.",tom hulme,Google Ventures
"Tom earned a first class bachelor’s degree in physics from the University of Bristol, and an MBA from Harvard Business School, where he received the Baker Scholar Award of high distinction. He also received an honorary doctorate from University of the Arts London.",tom hulme,Google Ventures
Joe has been with GV since 2009.,joe kraus,Google Ventures
"Prior to GV, Joe was a two-time entrepreneur. In 1993, he co-founded Excite.com, an early Internet search engine, holding multiple positions in the company, including leadership roles in product, business development, and marketing. More recently, he co-founded JotSpot in 2004, a wiki company that was acquired by Google in 2006. While at Google, Joe had multiple product management roles including Blogger, Picasa, Sites, Friend Connect, and OpenSocial.",joe kraus,Google Ventures
"In addition, Joe has been an active angel investor in multiple companies, including LinkedIn, Aardvark (sold to Google in 2010), Kongregate, and OpenCandy. Joe is also on the board of the Electronic Frontier Foundation (EFF.org).",joe kraus,Google Ventures
Joe received a B.A. from Stanford University.,joe kraus,Google Ventures
"John is a partner at GV, focused on investments in consumer marketplaces, e-commerce and enterprise companies. Prior to joining GV, John spent a decade at Google where he most recently served as head of partnerships and marketing for Google for Entrepreneurs, overseeing partnerships with accelerators and incubators globally. He also created Google Demo Days to spotlight high-growth technology startups from around the world.",john lyman,Google Ventures
"John’s career prior to Google focused on progressive policy and advocacy. He was an early employee and helped launch the Clinton Global Initiative (CGI) to convene world leaders to solve pressing global challenges, and worked at the Center for American Progress (CAP), a progressive think tank in Washington D.C.",john lyman,Google Ventures
"John graduated from Georgetown University with a degree in government and has a master’s in public policy from the University of California, Berkeley.",john lyman,Google Ventures
"Shaun is an entrepreneur, investor, and scientist with a broad and eclectic background. As an investor and adviser, Shaun has worked with companies building everything from quantum computers to self-driving cars. ",shaun maguire,Google Ventures
"Prior to GV, Shaun co-founded two companies: Qadium and Escape Dynamics. Qadium is a San Francisco-based cybersecurity company that creates and organizes information about the world’s networked devices. Shaun is chairman at Qadium and maintains an active role there. Escape Dynamics built a space propulsion system based upon wireless power transfer that demonstrated an extremely high specific impulse. Shaun also previously worked at the Defense Advanced Research Projects Agency (DARPA). He was deployed to Afghanistan for three months and his team received a Joint Meritorious Unit Award for their work.",shaun maguire,Google Ventures
"Shaun has a master’s degree in statistics from Stanford, and masters degrees in mathematics and ‘control and dynamical systems’ from Caltech. He expects to receive his Ph.D. from Caltech by the summer of 2018. His doctorate research focused on quantum aspects of black holes.",shaun maguire,Google Ventures
"Laura joined GV in 2011 and is a partner on the investing team. Previously, she established GV’s marketing function, working with our portfolio on branding and growth.",laura melahn,Google Ventures
"Laura named Calico, Alphabet’s company aiming to slow aging and counteract age-related diseases. Prior to joining GV, Laura was a product marketing manager at Google, where she worked on Search, Maps, Analytics, and the brand. She developed the Street View snowmobile for the 2010 Winter Olympics and helped bring Search Stories to TV. Previously, Laura conducted research at the Cancer Research Center of Hawaii and in the University of Oxford biochemistry department.",laura melahn,Google Ventures
"Laura received her degree in molecular biology with honors from Princeton University, where she was elected to membership in Phi Beta Kappa. At Princeton she ran track and cross country and was a member of the geographically-challenged surf club.",laura melahn,Google Ventures
"Dave is a general partner at GV. His background is in building and leading enterprise software sales and operations teams for highly-technical products, under pressure in rapidly-changing markets.",dave munichiello,Google Ventures
"Dave joins GV from the executive leadership team of Kiva Systems, where he helped grow the enterprise-enabling robotics company to $100 million in annual revenue before it was purchased by Amazon for $775 million. Dave’s four years at Kiva were spent launching, leading, and growing enterprise sales, account management, pre-sales, professional services, and support organizations. He established a reputation for consistently recruiting top talent and leading high-performing teams. Dave played a key role at Kiva through its first year of integration with Amazon, as his organizations refocused to maximize the impact of Kiva’s continually-learning system on Amazon’s business for years to come.",dave munichiello,Google Ventures
"Dave’s career prior to Kiva included management consulting for The Boston Consulting Group and leading teams as a Captain in the U.S. military’s most elite units. His military leadership roles ranged from running a high-tech organization in Europe; to serving as an Aide de Camp to the Four Star General responsible for U.S. forces in Europe, Africa, and Afghanistan; to deploying with elite special operations teams worldwide, ensuring they were enabled by the world’s most advanced technologies.",dave munichiello,Google Ventures
Dave holds an MBA from Harvard Business School and a B.S. from Emory University in math and computer science.,dave munichiello,Google Ventures
"Lo joined GV from Comcast Ventures, where he focused on the Catalyst Fund, a group of investments in early stage technology startups led by entrepreneurs of color. He specializes in consumer technology investments, with an emphasis on mobile messaging, marketplaces, and e-commerce.",lo toney,Google Ventures
"Lo has held executive roles at both startups and global consumer brands. He was the general manager of Zynga Poker, the gaming company’s largest franchise, and held operating positions at Nike.com and eBay.",lo toney,Google Ventures
"Lo received his MBA from the Haas School of Business (University of California at Berkeley), where he completed the Management of Technology program, a joint curriculum program with the College of Engineering. He received his B.S. from Hampton University in Virginia.",lo toney,Google Ventures
"Andy is a general partner at GV. Drawing on his background as an engineer and founder, Andy helps companies bring early-stage technologies from concept to commercial launch. As an investor, he has backed several industry-first breakthroughs in manufacturing, agriculture, robotics, logistics, and food. Andy’s investments include Carbon, Farmer’s Business Network, Abundant Robotics, and Orbital Insight.",andy wheeler,Google Ventures
"Andy co-founded Ember Corporation and delivered multiple industry firsts, including shipping the first ZigBee system-on-chip which is used in millions of smart meters around the world today. He went on to serve as the chief technology officer at Tendril Networks and Adura. ",andy wheeler,Google Ventures
Andy got his start in wireless and embedded technologies at the MIT Media Lab deploying large-scale sensor networks under a DARPA grant. He began his career at Zipcar where he developed the embedded wireless technology that powers the car-sharing service. Andy was selected for the Technology Review 100 Top Innovators Under 35 award in 2003 and has multiple patents in wireless networking and energy management. Andy received a Bachelor of Science and Master of Engineering in electrical engineering and computer science from MIT.,andy wheeler,Google Ventures
"Dr. Krishna Yeshwant is a physician, programmer, and entrepreneur who has been working with GV since its inception. He first joined Google as part of the New Business Development team.",krishna yeshwant,Google Ventures
"Prior to Google, Krishna helped start an electronic data interchange company that was acquired by Hewlett-Packard and a network security company that was acquired by Symantec. ",krishna yeshwant,Google Ventures
"Krishna has a B.S. in computer science from Stanford University. He also earned an M.D. from Harvard Medical School, an MBA from Harvard Business School, and completed his residency at Brigham and Women’s Hospital in Boston, Massachusetts where he continues to practice.",krishna yeshwant,Google Ventures
"Vineeta is a physician-scientist who is passionate about the intersection of data science and health care. As a director of product management at Flatiron Health, she has led development of national-scale databases that integrate clinical and genomic data for drug development and research in oncology.",vineeta agarwala,Google Ventures
"Previously, Vineeta studied the genetic basis of common disease at the Broad Institute of Harvard & MIT. She has also been a computational researcher at Cold Spring Harbor Laboratory and Lawrence Livermore National Laboratory, an early data scientist at Boston-based health tech startup Kyruus, and a management consultant for biotech, pharmaceutical, and medical device clients at McKinsey & Company in New York.",vineeta agarwala,Google Ventures
Vineeta has a B.S. in biophysics from Stanford University. She also earned M.D. and Ph.D. degrees from Harvard Medical School and MIT. She is currently a medical resident at Stanford.,vineeta agarwala,Google Ventures
"Blake is an engineer, scientist, and entrepreneur who has been working with GV since 2010. As an investor, Blake partners with founders on life-science and digital companies — from drug development and healthcare delivery to financial services and information security. Blake’s life-science investments include Denali, Grail, and ARMO BioSciences, and his digital investments include Gusto (formerly ZenPayroll), Robinhood, Ionic Security, and LendUp. ",blake byers,Google Ventures
"Prior to GV, Blake helped start two companies, led research projects on biomedical engineering and stem cells at Stanford, and was an angel investor. ",blake byers,Google Ventures
Blake received a Ph.D. and master’s in bioengineering from Stanford University and holds Bachelor of Science degrees in biomedical engineering and economics from Duke University.,blake byers,Google Ventures
"Scott Davis holds degrees in physics, mechanical and biomedical engineering, and brings broad technical expertise to the team as well as hands-on startup experience.",scott davis,Google Ventures
"Scott is a professor of engineering at Dartmouth College developing new optically-based cancer imaging techniques and contributes to the GV team on a part-time basis. Prior to his doctoral work in medical imaging, he was a key contributor to the success of Burlee.com, a leading Web hosting company acquired by Interland, Inc., now Web.com.",scott davis,Google Ventures
"Scott received a B.A. with honors in physics from Middlebury College, an M.S. in mechanical and aerospace engineering from the University of Virginia, and a Ph.D. in biomedical engineering from Dartmouth College.",scott davis,Google Ventures
"Anthony Philippakis is a physician, geneticist, and data scientist. He is currently a cardiologist at Brigham and Women’s Hospital, a venture partner at GV, and the chief data officer at Broad Institute of Harvard and MIT.  ",anthony philippakis,Google Ventures
"Anthony studied mathematics as an undergraduate at Yale University, followed by a master’s in mathematics at Cambridge University. He completed an M.D. at Harvard Medical School and a Ph.D. in biophysics at Harvard, working to develop computational methods for understanding transcriptional regulation. He completed his medical residency and cardiology fellowship at Brigham and Women’s Hospital.",anthony philippakis,Google Ventures
"Anthony is committed to bringing genome sequencing and data science into the practice of clinical medicine. As a clinician, he specializes in the care of patients with rare genetic cardiovascular diseases. He co-chairs the Scientific Advisory Board of Global Genes, is a strategic adviser to the American Heart Association, and sits on the Clinical Working Group of the Global Alliance for Genomics and Health.",anthony philippakis,Google Ventures
Ben is a medical resident in psychiatry at Massachusetts General Hospital and McLean Hospital. He co-founded a company to improve drug adherence at a community health center in Boston and a non-profit to operate a school for AIDS orphans in Tanzania.,ben robbins,Google Ventures
"Ben received his M.D. from Harvard Medical School, MBA from Harvard Business School, and B.A. with honors from Dartmouth College. He has been recognized multiple times for his social impact work, including the Harvard Medical School Dean’s community service award, Harvard Medical School Agents of Change seed grant, Harvard Medical School Master Scholar scholarship, and Harvard Business School Social Enterprise fellowship.",ben robbins,Google Ventures
"Dr. Krishna Yeshwant is a physician, programmer, and entrepreneur who has been working with GV since its inception. He first joined Google as part of the New Business Development team.",krishna yeshwant,Google Ventures
"Prior to Google, Krishna helped start an electronic data interchange company that was acquired by Hewlett-Packard and a network security company that was acquired by Symantec. ",krishna yeshwant,Google Ventures
"Krishna has a B.S. in computer science from Stanford University. He also earned an M.D. from Harvard Medical School, an MBA from Harvard Business School, and completed his residency at Brigham and Women’s Hospital in Boston, Massachusetts where he continues to practice.",krishna yeshwant,Google Ventures
"Kate is a leader with experience running design teams at enterprise scale and at startups alike. She brings a wealth of management, design, and product experience to our portfolio companies.",kate aronowitz,Google Ventures
"Kate has built design teams at eBay, LinkedIn, Facebook, and Wealthfront. She joined the first user experience team at eBay before taking her experience to LinkedIn where she started their user research team. As Facebook’s first design executive, Kate grew the organization from 20 to 200, establishing multidisciplinary design teams in front end engineering, user research, content strategy, and communication design. Kate joined Wealthfront in 2015 as their first vice president of design. She was integral in driving product strategy and defining their product development process. ",kate aronowitz,Google Ventures
"Kate holds a Bachelor of Arts in graphic design from the Savannah College of Art and Design. She was named to Fast Company’s list of the Most Influential Designers and to Ad Age’s Most Creative People. She has also served as a juror for the National Design Awards. In her spare time, Kate coaches executive teams, teaching them to better leverage design and train upcoming design leaders.",kate aronowitz,Google Ventures
"Kristen joined GV from the Google sales and marketing teams, where she partnered with executives to optimize operations and develop organizational culture. ",kristen brillantes,Google Ventures
"Prior to Google, Kristen was flipping foreclosures and served as executive director of an award-winning, nonprofit dance company. ",kristen brillantes,Google Ventures
Kristen graduated from UC Berkeley with a B.A. in public health and a minor in education.,kristen brillantes,Google Ventures
"Vanessa is a product design leader who builds products for consumer and enterprise customers across the globe. She has started and grown design teams in industries ranging from cloud and productivity software, to e-commerce, to hardware.",vanessa cho,Google Ventures
"Prior to joining GV, Vanessa led a team of 180 at Google as head of UX for GSuite. She delivered communication and collaboration experiences for products like Gmail, Hangouts, Calendar, and Drive. Previously, Vanessa was head of UX at GoPro and Walmart Labs where she scaled their product design and research teams.",vanessa cho,Google Ventures
Vanessa is an advocate of listening to customers early and often throughout product development. She enthusiastically promotes diversity of thought and experiences in teams to foster creative environments.,vanessa cho,Google Ventures
Vanessa was born and raised in Austria to Korean parents before she moved to the United States. She attended Brown University and the Rhode Island School of Design.,vanessa cho,Google Ventures
"Since 1990, Michael has helped companies design products based on new insights about their customers. After stints at The Learning Company, Electronic Arts, and America Online, Michael consulted with a wide variety of companies, such as Alcoa, DuPont, Ericsson, Incyte, Palm, Maytag, Unilever, and Sun Microsystems.",michael margolis,Google Ventures
"After the dot-com bust, Michael joined Walmart.com, where he spearheaded user research that helped design and grow many new online and cross-channel businesses. In 2006, Michael started at Google as a staff user experience researcher, where he conducted research for Gmail and Google Talk, led the UX research team for Google Apps, and managed the user experience team in Google’s Seattle and Kirkland offices. In 2010, he was called up to the GV Design Studio.",michael margolis,Google Ventures
"Michael earned his bachelor’s and master’s degrees in anthropology from Stanford University. After many years in the San Francisco Bay Area, Michael is living happily ever after in the Seattle area.",michael margolis,Google Ventures
Graham Spencer is a managing partner at GV. ,graham spencer,Google Ventures
