text,name,firm
I’m personally interested in AR and VR. I think those are the next big platforms post-mobile.,Jess Lee,Sequoia Capital
"In my first interview with Marissa she told me, whenever she’d had to choose between two paths, she always tried to pick the more challenging one. And that advice has stayed with me. It drove me to go to Polyvore when I was happy at Google. It drove me to be CEO when I was VP of Product. It drove me here, right? ",Jess Lee,Sequoia Capital
Challenge yourself.,Jess Lee,Sequoia Capital
"I don’t think I quite fit the traditional mould for what a CEO is supposed to be like. Personality-wise, a certain set of skills, being introverted — none of those things are your classic CEO. Figuring out how to lead in my own style, authentically, has shaped me tremendously.",Jess Lee,Sequoia Capital
"The strength of an introvert is that, if you don’t like the spotlight on yourself, you put it naturally on your team. ",Jess Lee,Sequoia Capital
Do a few things well. No one is good at everything. You have to figure out the one thing you’re really good at and just work your ass off.,Jess Lee,Sequoia Capital
"Maybe because of my upbringing — I’m an immigrant from Italy, I actually came on a boat at the age of 11 — there’s something to be said for the feeling of desperation and the feeling you have no choice but to win.",Doug Leone,Sequoia Capital
"The old adage that, “if it ain't broke, don't fix it,” does not apply to Sequoia Capital. It’s the exact opposite. If something is working like a dream, we modify it, we try to break it, because competitors and new entrants will try to find new ways to beat us.",Doug Leone,Sequoia Capital
"When we first met the team at Meraki, it was clear that the founders and the product were exceptional, but the market they were planning to chase was not. We spent the first two years exploring four different markets until we found the one that worked. Their early days were not easy and the company struggled. Eventually, when they zeroed in on the appropriate market opportunity, revenues skyrocketed. ",Doug Leone,Sequoia Capital
There are exactly zero successful founders who weren’t insistent on doing things their own way.,Doug Leone,Sequoia Capital
"Great founders listen to all points of view and then march down whichever path they deem most productive. They can be irreverent and stubborn, but that’s not a bad thing. Placating them when we disagree is. It’s OK to have a spirited conversation based on facts and not emotions…and in the end, it is the founder who decides the path. ",Doug Leone,Sequoia Capital
"None of the companies where I serve on the board are “Doug Leone companies.” They are Sequoia Capital companies. We work as a team. A founder has not just Doug Leone or Jim Goetz on the board, but all of Sequoia Capital.",Doug Leone,Sequoia Capital
"When I meet an entrepreneur who’s considering partnering with us, I tell her that I’m not a founder’s friend. I am a founder’s business partner. My job is to do everything in my power to help make her and her company enormously successful. I’ll work 24/7 to help realize the full potential of her idea.  We will likely become good friends over time.",Doug Leone,Sequoia Capital
"If a founder wants a nodding bobble head, we’re the wrong partners, and I am certainly the wrong board member.",Doug Leone,Sequoia Capital
"Hire people who think from first principles. If you have a playbook written in indelible ink, or if you know the answer before the question is asked, you are not for us.",Doug Leone,Sequoia Capital
"Choose to have kids or not. But if you choose to have kids, invest in your kids. That is the most important thing you can do in your life.",Doug Leone,Sequoia Capital
"My first job in sales was selling north of 96th Street in New York City. Now it's cool to be north of 96th Street. Let me tell you, in 1979 it was not safe to be north of 96th Street. But that location had Columbia University, where someone explained to me what the ARPANET was. And that eventually led to a job at Sun Microsystems.",Doug Leone,Sequoia Capital
"If you pitch to Sequoia, just describe clearly your vision, your product, and the business around your product. Remember, you are selling shares, not selling just product. We don’t need a balance sheet for the year 2020.",Doug Leone,Sequoia Capital
"Crystal-clear thinking is one of the things we look for. Not a fancy slide pitch, but crystal-clear thinking.",Doug Leone,Sequoia Capital
Avoid pontificating board members with nothing to say.,Doug Leone,Sequoia Capital
"Sequoia looks for people from humble backgrounds. Maybe something happened in our lives early on, our system was shocked, and we have this unbelievable need to stay on top and to succeed.",Doug Leone,Sequoia Capital
It’s why I get up at 4:30 every morning to work out. I want to make sure I don’t lose an inch on the edge front. ,Doug Leone,Sequoia Capital
"Make no mistake: We want to be the very first penny of capital into young companies for the simple reason that we want to be their business partner from day one. We know from experience over many, many years that the DNA of a company is often set in the first 30, 60, or 90 days.",Doug Leone,Sequoia Capital
"Make sure you have a partner who has experience, bandwidth, and tells it like it is.  The last thing a founder needs is to have to figure out what his board member actually means.  ",Doug Leone,Sequoia Capital
"A great investor partner completely appreciates how difficult the life of a founder is, and he should do everything in his power to help him succeed. Adding stress is not helpful.",Doug Leone,Sequoia Capital
"Venture is quite a competitive business. Everybody is saying exactly the same things, but only a few firms are able to deliver for portfolio companies.",Doug Leone,Sequoia Capital
"Next time you hear from an investor that he’s “founder-friendly” as part of his sales approach, you may want to raise your antenna in the same way you would when a stranger starts calling you “buddy” a few minutes after he meets you. It’s a marketing tagline meant to disarm you.",Doug Leone,Sequoia Capital
"If you come to present at Sequoia there are no phones out, no one looking at email, the meetings start on time. We try to treat people the way we would treat someone in our living room. Because we completely understand the pressure you’re under when you come to see us. We take that presentation and the conversation that follows quite seriously.  We don’t expect you to have all your facts buttoned up.  We have partnered with numerous founders at the very earliest stages of their company.",Doug Leone,Sequoia Capital
We don't have flower children here. We will ask questions if we have them.,Doug Leone,Sequoia Capital
I hate talking about the past. The one thing you should know about me is that I rarely take photographs. Because I’m afraid that photographs tie me back to the past.,Doug Leone,Sequoia Capital
We're paranoid as heck. We're always one or two decisions away from becoming a second-tier firm. And that is very clear in our minds.,Doug Leone,Sequoia Capital
"We have a heterogeneous set of talents at Sequoia. We have engineers, sales, marketing, finance, Italians, Chinese, Indians. But we would benefit by having more women on our investment team.",Doug Leone,Sequoia Capital
The founders and management teams do 99% of the work. They’re the ones who should be in the limelight.,Doug Leone,Sequoia Capital
I have no idea what’s hot. But I’m certainly always listening. Big Dumbo ears. Just listening.,Doug Leone,Sequoia Capital
I’m an operator. I’ve been fortunate enough to help scale three companies from the founding stages to profitable businesses and through successful acquisitions.,Alfred Lin,Sequoia Capital
"I joined Sequoia because I had worked with Sequoia partners for a long time as an operator, and almost all Sequoia partners have worked at, started, and been part of the management team at companies that have done extraordinary things. ",Alfred Lin,Sequoia Capital
"Airbnb started with an air mattress and a radical vision of what hospitality could mean. As the seed investor, Sequoia partnered with Airbnb before it was clear to all that they could design trust among strangers, making a better way to travel and creating a way for people everywhere to belong anywhere.",Alfred Lin,Sequoia Capital
"If your goal is to get straight As and never speed, you're probably not cut out to disrupt an industry, which requires original thinking, an ability to see the world differently from others, and courage to challenge conventional wisdom when it doesn't make sense.  (This is not saying you should be lazy, get Cs, intentionally do bad things, break the law, and challenge conventional wisdom for just the sake of it.)",Alfred Lin,Sequoia Capital
A tall tale about one of my college jobs was buying whole pizzas and selling them by the slice to my roommates at Harvard. It wasn't predatory — honest.,Alfred Lin,Sequoia Capital
"When I was contemplating going to business school after LinkExchange was sold to Microsoft, Michael Moritz (who graduated from Wharton, but never includes it in his bio) told me, “You learn more in three months at a startup than at business school.”  I've been working at or with startups ever since.",Alfred Lin,Sequoia Capital
"When I was in a PhD program in statistics, Tony [Hsieh] would say that must be like watching paint dry, in the dark, as part of his way to recruit me into LinkExchange. I would laugh at that because, while I love math and numbers, I also had a passion for business. Dropping out was a hard conversation with my traditional Taiwanese parents.",Alfred Lin,Sequoia Capital
"I've been on both sides of being an operator and an investor, and I think it’s a privilege to have been on both sides.",Alfred Lin,Sequoia Capital
"I remember pitching Sequoia when I was at LinkExchange, at Tellme, at Zappos, so I can relate that fundraising is a pain.",Alfred Lin,Sequoia Capital
"The thing that culture, customer service, and fitness all have in common is that if you don't make it a daily habit, it's not going to be your core competency. Focusing on culture or customer service when it is already bad is similar to going on a crash diet and working out only when you notice when you are out of shape.",Alfred Lin,Sequoia Capital
"The 80/20 rule doesn't apply to entrepreneurship. Since the vast majority of companies fail, you don’t get rewarded unless you are above the 99.9th percentile.",Alfred Lin,Sequoia Capital
"Those charts that show exponential growth, if you narrow it down to the very early beginnings, it looks quite flat. It takes a long time to get the flywheel going. So don't be discouraged.",Alfred Lin,Sequoia Capital
Think about all the people that you've never liked working with. What values do they have? Think of the opposite of that. Maybe those should be considered values for your company. ,Alfred Lin,Sequoia Capital
"At Sequoia, we don’t want to be treated any differently than your co-founder or your management team. We want to be there in the trenches with you, and be able to discuss any problem you have.  We pride ourselves on being the first call you make when you want unconventional and prescient advice.",Alfred Lin,Sequoia Capital
"Who’s going to be your worst reference and why? I like asking that question just to see how introspective and brutally honest you are about yourself. If you can’t be transparent about that, we haven’t established the right level of trust yet to be business partners.",Alfred Lin,Sequoia Capital
By training I’m an applied mathematician and statistician. I can definitely geek out on bootstrapping statistics as well as companies.,Alfred Lin,Sequoia Capital
"My earliest computing memory is an abacus — which I could never use, despite my dad being the number two abacus champion in Taiwan.",Alfred Lin,Sequoia Capital
"My parents emigrated to the United States because they wanted a better life for me and my brother. We went from middle class to poor in that move, but my parents told us that we were temporarily poor. At the age of six, I didn't understand what they were trying to tell me.  Today, I know the most valuable lesson from my parents was not that the US necessarily provides for a better life, it was that if you are intellectually curious, goal oriented, and work hard, you will figure things out. ",Alfred Lin,Sequoia Capital
"In some ways you should ignore the climate. If you love what you're doing, you’re going to love it during good or bad times. ",Alfred Lin,Sequoia Capital
I didn't think raising too much money could be a bad thing until I saw how easy it is for once disciplined founders to blow through money when they start thinking certain things are not “worth” their time.,Alfred Lin,Sequoia Capital
"Raising a very large round might be a good vanity metric, but it rarely leads to great operating businesses.",Alfred Lin,Sequoia Capital
"People date for many years before they get married, and half of those partnerships still end in divorce. Why would relationships on the business side be any different? I would spend more time getting to know people before you let them invest in your company. Because if things go well, it's a five, ten, fifteen-year journey.",Alfred Lin,Sequoia Capital
"To this day my mother still asks me, “When are you going to go back and finish your PhD?” It’s unlikely.",Alfred Lin,Sequoia Capital
"If you look at our most successful partnerships, the founders started the company, built the company, and are at the helm.",Michael Moritz,Sequoia Capital
"When we first get involved with a tiny company, nothing is obvious. If you’re looking for certainty you wind up with boring people engaged in mundane activities. We have a fondness for obsessives on a mission. This was the case when we met the founders of what would become Google, Stripe, Yahoo, and PayPal and we hope it’s true when we meet you.",Michael Moritz,Sequoia Capital
I wouldn’t be here today if not for the generosity of strangers.,Michael Moritz,Sequoia Capital
"When I started at Sequoia Capital, there was no way we could have considered helping form companies addressing financial services, media, advertising, entertainment, or personalized medicine. But technology has seeped into every crevice of the economy.",Michael Moritz,Sequoia Capital
"If we encountered someone like Larry Page or Steve Jobs every five years, we'd be on the tips of our toes with excitement.",Michael Moritz,Sequoia Capital
"Many kids I went to school with, their dads were unemployed or had part time work. Many of them didn’t have very much money. This was Britain in the early 1970s when there were gas strikes and coal strikes. It was pretty bleak and miserable.",Michael Moritz,Sequoia Capital
Growing up in Wales made you understand what being an outsider is like.,Michael Moritz,Sequoia Capital
"Everyone at Sequoia Capital works in the same open space so we can see each other, gossip mindlessly and hurl choice epithets when appropriate.",Michael Moritz,Sequoia Capital
"Few markets are as ferociously competitive as the technology business in China. People there simply work a lot harder. And when you ally that with talent, creativity and a hunger to succeed, it’s a formidable concoction.",Michael Moritz,Sequoia Capital
"In China these days, there are probably four Silicon Valleys. In the US, there’s one.",Michael Moritz,Sequoia Capital
I came to America in 1976 without actually knowing anyone here. No grand plan whatsoever. And one thing led to another. I wound up as a correspondent for Time Magazine and was transferred to San Francisco.,Michael Moritz,Sequoia Capital
"At the time all I knew was that California was the leftmost part of America, and after that you fell off into the water.",Michael Moritz,Sequoia Capital
America was built on immigrants. Today it’s impossible to satisfy Silicon Valley's appetite for engineers and scientists with people born here.,Michael Moritz,Sequoia Capital
"On the whole, we really dislike it when founders sell their company.",Michael Moritz,Sequoia Capital
We're looking for people who are at the beginning of a great pursuit that they think will account for pretty much every waking moment of their foreseeable future. And who are following a deeply ingrained interest that they're ready to proselytize to the world.,Michael Moritz,Sequoia Capital
"Founding a company is the hardest act in business, and people who haven't done it don't really understand.",Michael Moritz,Sequoia Capital
It’s fortunate that most large companies ignore or underestimate startups because otherwise even fewer would succeed and we would not have a business.,Michael Moritz,Sequoia Capital
"I wish I’d carved out time each day to, at a minimum, draw. The diversion and the tactile sensation of making something that hasn’t existed before buoys the spirits.",Michael Moritz,Sequoia Capital
Picking up a paintbrush in middle-age is not for the faint of heart.,Michael Moritz,Sequoia Capital
The people who know us well really like being in business with us. We’ve worked multiple times with the same people and we always invite founders to simply talk with all the people we’ve been in business with and make up their own minds.,Michael Moritz,Sequoia Capital
"If you can’t say to a buddy of yours that having us as a partner was one of the very best decisions of your business life, then we’ve failed you.",Michael Moritz,Sequoia Capital
"The Ball is Round. For those interested in the history of football, sometimes called soccer, this book is the first and last word.",Michael Moritz,Sequoia Capital
"I derive great fulfillment from helping others achieve their full potential. I’m obsessed with technology and building companies. I feel lucky to have discovered the best role for me, and that’s a supporting role, behind the scenes, for the greatest founders, teams, and companies of tomorrow.",Bryan Schreier,Sequoia Capital
"You will not find me at conferences. I do not write blog posts. I avoid “humble” self-promotion on Twitter and Facebook. It’s not about me. This behavior is part focus and part allergy. Don’t get me wrong — I love working with people. That is what gets me up in the morning. It is what I do. However, anything that is more than a degree away from supporting a company or founder feels like misused time.",Bryan Schreier,Sequoia Capital
"We met Drew Houston and Arash Ferdowsi in a tiny Russian Hill apartment in 2007. In addition to being the founders of Dropbox, they were also the only employees. All it took was an introduction and a pre-launch demo to make it clear to us that they had both the vision and the skills to become the center of peoples' digital world.",Bryan Schreier,Sequoia Capital
This might sound over the top. It isn’t. My goal is to be the founder’s first call. This is not something an investor can add to a term sheet. It has to be earned through trust and delivery. And it is definitely not glamorous.,Bryan Schreier,Sequoia Capital
"Building companies is messy. I’m normally involved in the ugly parts of company development — not the nifty, glamorous ones.",Bryan Schreier,Sequoia Capital
Most of my learned behavior comes from early on. My father sacrificed his career to give me the gift of education — because he thought I had potential. The high school he sent me to developed my sense of service to others.,Bryan Schreier,Sequoia Capital
I appreciate the alignment in our business - we win by helping our companies win.  The only thing better than winning is seeing Sequoia companies win.,Bryan Schreier,Sequoia Capital
"I’ve never run a real company but I learned from one of the great leaders of our time. She taught me how to take a team from zero to thousands, and how to creatively address any challenge thrown in front of me. She also taught me about loyalty beyond loyalty, and how to fight for your people. I built my practice on that foundation.",Bryan Schreier,Sequoia Capital
"In business, my people are my founders and my partners.",Bryan Schreier,Sequoia Capital
"You’ll be able to find the other stuff you need to know about me through the founders I work with and maybe a bit of Twittering. That said, it really is pretty simple: I thrive on partnering with people who will make a dent in tomorrow — and being there for whatever they need to maximize that dent.",Bryan Schreier,Sequoia Capital
Children grow up thinking they can do anything. Life slowly teaches you all the things you supposedly can’t do. It’s why most of the truly great companies are founded by really young entrepreneurs. They haven’t yet learned what they can’t do.,Mike Vernal,Sequoia Capital
The best founders are relentless learners. We saw this with Patrick and John when we first met Stripe - there were only 3 employees when we partnered with them. A small team of people with vision and drive can change the world.  ,Mike Vernal,Sequoia Capital
"Don’t play by someone else’s rules. The very best entrepreneurs don’t chase an existing competitor or market. They create their own game with its own rules and, in the process, create a whole new market.",Mike Vernal,Sequoia Capital
"The best consumer products tend to do one thing really, really well. Once you figure out what that is, just keep making it better and better. Resist the temptation to prematurely add more features.",Mike Vernal,Sequoia Capital
"When I was 11 years old, I won a trip for my family and me to Denmark. There was a contest at a toy store to guess the number of pieces in a giant Lego Christmas display. I think I was off by seven.",Mike Vernal,Sequoia Capital
Don’t mistake motion for progress. It was one of my favorite sayings at Facebook. I’ve seen a lot of talented achievers confuse being busy with actually doing something important. Find the small number of things that really matter and focus all your energy on them.,Mike Vernal,Sequoia Capital
"When I first graduated from college, I thought you were supposed to design novel, thoughtful, elegant solutions to problems. I eventually learned to just find the quickest, simplest solution and move on to the next problem. Done is better than perfect.",Mike Vernal,Sequoia Capital
"Hire for slope, not y-intercept. If you’re a fast-growing startup, you need people who can scale with the company. Hire people who have shown they can grow quickly, rather than people with lots of experience but slow growth curves.",Mike Vernal,Sequoia Capital
"I started out believing that you could build a great developer platform and let someone else build the killer app. When that didn’t work, I figured you had to build both at the same time. I finally realized that great platforms evolve out of killer apps.",Mike Vernal,Sequoia Capital
"In consumer, the best product leaders are students of human nature. They think about how a product makes people feel and how those emotions propagate through the network.",Mike Vernal,Sequoia Capital
"My first computer program was a 50,000-line version of Battleship in Pascal, complete with ASCII animations when the ships sank. When I learned that you could define your own functions, it got a lot shorter.",Mike Vernal,Sequoia Capital
"Creating value is not enough. To build a great company, you need to make sure you can capture some of the value you create. Most early technologists don’t pay enough attention to how they’re going to sustainably capture value.",Mike Vernal,Sequoia Capital
"My favorite class in college was CS161 (Operating Systems). Each assignment involved writing a huge chunk of the operating system – the memory manager, the file system, etc. It was the best possible training for understanding how computers really work.",Mike Vernal,Sequoia Capital
"I grew up in a tiny apartment outside New York City. One day when I was 5, my oldest brother told me to stand between two chairs and started shooting hockey pucks at me. Thus began my 15-year career as a goalie. Eventually someone bought me a helmet.",Mike Vernal,Sequoia Capital
I love partnering with thoughtful visionaries who have the grit to turn their dreams into reality.,Stephanie Zhan,Sequoia Capital
"I remember my first chat with Against Gravity. Listening to the team’s vision was a magical peek into VR as a promising computing platform, and inspired us to dream about the future of communication and collaboration. We led the seed just 3 weeks post-launch. ",Stephanie Zhan,Sequoia Capital
I’m a big believer in the saying that you are the average of the five people you spend the most time with. Choose your partners thoughtfully.,Stephanie Zhan,Sequoia Capital
"Growing up in Beijing and Hong Kong, I watched technology facilitate rapid economic development from WeChat as a new OS, to the electric bicycle revolution. Living in a state of constant change has made me crave continuous innovation.",Stephanie Zhan,Sequoia Capital
"As a competitive swimmer, I learned early to never become complacent. When your main competition is the clock, you can always do better. I live by this philosophy.",Stephanie Zhan,Sequoia Capital
"Today I’m excited about the future of social, marketplaces, commerce, voice computing, AR/VR, autonomous vehicles, and applied AI.",Stephanie Zhan,Sequoia Capital
Come chat with us - it’s never too early to start a conversation. We can’t wait to learn more about what makes you tick...,Stephanie Zhan,Sequoia Capital
"I remain infinitely fascinated with how technical twenty-somethings view the world in a highly unconventional way and want to build products their way, not someone else's.",Donald Valentine,Sequoia Capital
