text,name,firm
"DJ Patil joined Venrock in 2017 as an Advisor to the firm. He has held a variety of roles in Academia, Industry, and Government, most recently he was appointed by President Obama to be the first U.S. Chief Data Scientist where his efforts led to the establishment of nearly 40 Chief Data Officer roles across the Federal government. He also established new health care programs including the Precision Medicine Initiative and the Cancer Moonshot, new criminal justice reforms including the Data-Driven Justice and Police Data Initiatives that cover more than 94 million Americans, as well as leading the national data efforts. He also has been active in national security and for his efforts was awarded by Secretary Carter the Department of Defense Medal for Distinguished Public Service, which is the highest honor the department bestows on a civilian.",DJ Patil,Venrock
"In industry, he led the product teams at RelateIQ which was acquired by Salesforce, and was founding board member for Crisis Text Line, which works to use new technologies to provide on demand mental and crisis support. He was also Chief Scientist, Chief Security Officer and Head of Analytics and Data Product Teams at the LinkedIn Corporation where he co-coined the term Data Scientist. He has also held a number of roles at Skype, PayPal, and eBay.",DJ Patil,Venrock
"As a member of the faculty at the University of Maryland, his research focused on nonlinear dynamics and chaos theory and he helped start a major research initiative on numerical weather prediction.  As an AAAS Science & Technology Policy Fellow for the Department of Defense, Dr. Patil directed new efforts to leverage social network analysis and the melding of computational and social sciences to anticipate emerging threats to the US. He has also co-chaired a major review of US efforts to prevent bioweapons proliferation in Central Asia and co-founded the Iraqi Virtual Science Library (IVSL).  In 2104 he was selected by the World Economic Forum as a Young Global Leader and is also a Member of the Council of Foreign Relations.",DJ Patil,Venrock
"Bryan joined Venrock as a Kauffman Fellow in 1997. He is based in Palo Alto and invests broadly across the healthcare industry. Bryan is currently involved with numerous public and private companies including 10X Genomics, Castlight Health, CloudFlare, Grand Rounds, Intarcia, and Lyra Health. Past investments include Ariosa Diagnostics (acquired by Roche), athenahealth (NASDAQ: ATHN), Ikaria (acquired by Mallinkrodt), Illumina (NASDAQ: ILMN), Ironwood Pharmaceuticals (NASDAQ: IRWD), Sirna Therapeutics (acquired by Merck), and Zeltiq (acquired by Allergan). Bryan was named a Henry Crown Fellow by the Aspen Institute in 2006 and has ranked on Forbes’ Midas List nine times, 2008 – 2017.",Bryan Roberts,Venrock
"Immediately prior to joining Venrock, Bryan received his Ph.D. in Chemistry & Chemical Biology from Harvard University. He received his B.A. from Dartmouth College.",Bryan Roberts,Venrock
"Alex Rosen focuses on healthcare investments in Venrock’s New York office. Prior to joining Venrock, Alex earned an MD from the University of Pennsylvania School of Medicine, where he was elected to the Alpha Omega Alpha Honor Medical Society and the Gold Humanism Honor Society. He also earned an MBA in Health Care Management from the Wharton School, where he graduated with Honors and received a Kaiser Fellowship. He has published several articles in research journals and received Penn Med’s James B. Couch Prize for achievements in the dual disciplines of medicine and business.",Alex Rosen,Venrock
"In addition to his clinical training, Alex did internships at McKinsey & Company and in business development at Regeneron Pharmaceuticals, Inc.",Alex Rosen,Venrock
"He earned an AB in Economics from Princeton University, where he served as Class President for all four years, conducted independent research in health economics, and received the Moses Taylor Pyne Honor Prize, the highest general distinction conferred on an undergraduate.",Alex Rosen,Venrock
"Cami Samuels joined Venrock in 2014 and focuses on healthcare with an emphasis on biotech, medical devices, and consumer health. She currently serves on the board of Spirox Medical and Unity Biotechnology, and recently stepped off the board of REGENXBIO (RGNX). Prior to Venrock, Cami was a Managing Director at Versant Ventures for a decade where she led investments in Achaogen (AKAO), Kythera (KYTH), Novacardia (acquired by Merck), and ParAllele (acquired by Affymetrix), among others. She was also a board observer at several companies including Genomic Health (GHDX), Fluidigm (FLDM), and Syrrx (acquired by Takeda).",Camille Samuels,Venrock
"Before Versant, she was responsible for business development at Tularik, Inc. (acquired by Amgen) where she in-licensed two of the company’s clinical-stage products and led Tularik’s Technology Acquisition Group. Before Tularik, Cami worked in corporate development at Genzyme and Millennium Predictive Medicine, and was a management consultant to healthcare and biotech companies at LEK Consulting.",Camille Samuels,Venrock
"Cami earned her Bachelor’s degree in Biology from Duke University and an MBA from Harvard Business School, where she graduated as a Baker Scholar. In 2002, The Aspen Institute named Camille a Henry Crown Fellow.",Camille Samuels,Venrock
"Nimish Shah joined Venrock’s New York office in 2013 and focuses on a range of healthcare subsectors including generics, specialty pharmaceuticals, biotechnology and animal health. Most recently, he worked at Citadel and was involved in the firm’s healthcare investments. Prior to Citadel, Nimish was a Research Analyst at Credit Suisse covering the specialty pharma and generics sectors. Nimish began his career as a retail pharmacist and later spent time working in the Medical Affairs department at Novartis. He received his BS in pharmacy with honors from Rutgers College of Pharmacy, MPH from the Mailman School of Public Health at Columbia University, and MBA from Columbia Business School.",Nimish Shah,Venrock
"As Associate General Counsel, Sherman works on a variety of legal matters arising from Venrock’s investments, operations and regulatory compliance.  Sherman joined Venrock in 2009 from Cooley, where he was a member of the firm’s business department, in the emerging company practice group.  Sherman’s practice at Cooley focused on the formation, financing and representation of emerging growth companies, with an emphasis on securities transactions, including private equity financings, public offerings and mergers and acquisitions.  Additionally, his practice included the representation of public companies in public offerings, private placements, mergers and acquisitions and periodic reporting requirements.  These practice areas complement each other well and serve Venrock and our portfolio companies.  ",Sherman Souther,Venrock
Sherman is a member of the State Bar of California and the American Bar Association. He earned his B.A. in International Affairs from the University of Colorado and his J.D. at the Duke University School of Law.,Sherman Souther,Venrock
"David is responsible for overseeing the operations and administration of the firm. David also serves as Chief Compliance Officer and General Counsel, managing the firm’s regulatory, legal, and compliance programs. David joined Venrock in 2007 from Cooley LLP, where his practice focused on the formation and representation of venture capital partnerships and the representation of emerging growth and smallcap public technology companies.",David Stepp,Venrock
David is a member of the State Bar of California and the American Bar Association. He earned his B.S. in Molecular and Cellular Biology from the University of Arizona and his J.D. from Harvard Law School.,David Stepp,Venrock
"Mike joined Venrock in 1999 after 16 years as an entrepreneur at venture-backed companies. He serves on the boards of AppNexus, Aria Systems, Cygilant, Numerated, and Salsify. Notable previous investments include Bizo (acquired by LinkedIn), DataPower (acquired by IBM), Endeca Technologies (acquired by Oracle), ExtendMedia (acquired by Cisco), IMlogic (acquired by Symantec), Pedestal Software (acquired by Altiris), ZoomInfo (acquired by Great Hill), and WHERE (acquired by eBay).",Mike Tyrrell,Venrock
"Prior to Venrock, Mike spent nine years with Spyglass, a Venrock-backed portfolio company, joining as their sixth employee to run sales and marketing. Spyglass licensed the first internet browser, Mosaic, to many of the world’s leading software, online services, and device companies, including Microsoft. As the Executive Vice President, Mike helped take the company public in 1995. Before Spyglass, he was with two other start-ups, Multiflow Computer and Celerity Computing, both UNIX systems pioneers. Mike began his career at Prime Computer.",Mike Tyrrell,Venrock
Mike earned his B.S. in Business Administration at the University of New Hampshire.,Mike Tyrrell,Venrock
 ,Mike Tyrrell,Venrock
Adam focuses on early stage investments in Venrock’s Palo Alto Office. He is a board observer at Smart Biz Loans.,Adam Wang-Levine,Venrock
"Prior to Venrock, he served in the Obama Administration from 2009-2013 as a Senior Policy Advisor at the National Economic Council and National Security Council. His domestic work focused on the response to the 2008 financial crisis, implementation of the Dodd-Frank Act, and housing finance reform. His international work focused on US-China strategic and economic relations as well as broader international trade issues.",Adam Wang-Levine,Venrock
"Prior to the White House, he worked with McKinsey and Company in their Corporate Finance Group and Segovia Technology, a global payments business both based in New York.",Adam Wang-Levine,Venrock
"He also worked with Goldman Sachs in Hong Kong, Moore Capital in London, and the World Bank in Beijing.",Adam Wang-Levine,Venrock
"Adam received his undergraduate degree from Stanford University and MBA and MPAID from Harvard Business School and Harvard Kennedy School. At Harvard, his thesis advisor was Lawrence Summers and he was a research assistant for Jeremy Stein. He was a Fulbright Scholar at Tsinghua University in Beijing.",Adam Wang-Levine,Venrock
"Tom joined Venrock as a Partner in 2017. Based in the Palo Alto office, he focuses on early stage consumer technology. Previously, Tom was the Chief Product Officer at Coursera, where he was employee number 50 and established and scaled up the product management and design teams. In addition, he led engineering, operations and analytics. During his tenure, Tom helped the company build out a world-class product and launched four fully accredited online degrees, identified a business model that resulted in a 24x in quarterly revenue, built a world-class product organization and web-sales channel, and set the culture.",Tom Willerer,Venrock
"Prior to Coursera, Tom spent six years at Netflix, Inc., where he became one of the company’s most highly-regarded leaders in his role as Vice President of Product Innovation. Tom co-led the product management team at Netflix and was responsible for setting the vision and managing the teams responsible for Product Marketing, Messaging, Social and Individual Profiles. Among his accomplishments during his time at the company, Tom pioneered ways for members to exchange recommendations with friends, and helped Netflix grow from 8 million U.S.-only subscribers to 40 million subscribers in 41 countries.",Tom Willerer,Venrock
"Tom holds a business degree from Indiana University, where he was a pitcher on the varsity baseball team, and received his Master’s in New Media Studies from DePaul University.",Tom Willerer,Venrock
